Microsoft Windows [Version 10.0.19044.2006]
(c) Microsoft Corporation. All rights reserved.

C:\Users\Rony>cd \

C:\>cd xampp\mysql\bin

C:\xampp\mysql\bin>mysql -u root -p dbpegawai
Enter password:
Welcome to the MariaDB monitor.  Commands end with ; or \g.
Your MariaDB connection id is 29
Server version: 10.4.24-MariaDB mariadb.org binary distribution

Copyright (c) 2000, 2018, Oracle, MariaDB Corporation Ab and others.

Type 'help;' or '\h' for help. Type '\c' to clear the current input statement.

MariaDB [dbpegawai]> SHOW TABLES;
+---------------------+
| Tables_in_dbpegawai |
+---------------------+
| divisi              |
| pegawai             |
+---------------------+
2 rows in set (0.099 sec)

MariaDB [dbpegawai]> DESC pegawai;
+----------+---------------+------+-----+---------+----------------+
| Field    | Type          | Null | Key | Default | Extra          |
+----------+---------------+------+-----+---------+----------------+
| id       | int(11)       | NO   | PRI | NULL    | auto_increment |
| nip      | char(11)      | NO   | UNI | NULL    |                |
| nama     | varchar(30)   | NO   |     | NULL    |                |
| gender   | enum('L','P') | NO   |     | NULL    |                |
| tmplahir | varchar(30)   | NO   |     | NULL    |                |
| tgllahir | date          | NO   |     | NULL    |                |
| iddivisi | int(11)       | NO   |     | NULL    |                |
| alamat   | text          | YES  |     | NULL    |                |
+----------+---------------+------+-----+---------+----------------+
8 rows in set (0.176 sec)

MariaDB [dbpegawai]> desc divisi;
+-------+-------------+------+-----+---------+----------------+
| Field | Type        | Null | Key | Default | Extra          |
+-------+-------------+------+-----+---------+----------------+
| id    | int(11)     | NO   | PRI | NULL    | auto_increment |
| nama  | varchar(30) | NO   | UNI | NULL    |                |
+-------+-------------+------+-----+---------+----------------+
2 rows in set (0.117 sec)

MariaDB [dbpegawai]> INSERT INTO divisi (nama) VALUES
    -> ('SDM'),
    -> ('keuangan'),
    -> ('marketing'),
    -> ('IT');
Query OK, 4 rows affected (0.517 sec)
Records: 4  Duplicates: 0  Warnings: 0

MariaDB [dbpegawai]> SELECT * FROM divisi;
+----+-----------+
| id | nama      |
+----+-----------+
|  4 | IT        |
|  2 | keuangan  |
|  3 | marketing |
|  1 | SDM       |
+----+-----------+
4 rows in set (0.076 sec)

MariaDB [dbpegawai]> INSERT INTO pegawai (nip,nama,gender,tmplahir,tgllahir,iddivisi,alamat) VALUES
    -> ('2122','syahroni','L','probolinggo','2002-09-28',1,'sumberkembar'),
    -> ('2222','roni','L','malang','2002-09-01',1,'ranoon'),
    -> ('2223','fita','P','bali','2003-02-21',1,'bucor'),
    -> ('2224','fiki','P','lintang','2000-02-31',1,'denpasar'),
    -> ('2225','keira','P','pakuniran','2001-02-21',1,'bucor');
Query OK, 5 rows affected, 1 warning (0.241 sec)
Records: 5  Duplicates: 0  Warnings: 1

MariaDB [dbpegawai]> SELECT * FROM pegawai;
+----+------+----------+--------+-------------+------------+----------+--------------+
| id | nip  | nama     | gender | tmplahir    | tgllahir   | iddivisi | alamat       |
+----+------+----------+--------+-------------+------------+----------+--------------+
|  1 | 2122 | syahroni | L      | probolinggo | 2002-09-28 |        1 | sumberkembar |
|  2 | 2222 | roni     | L      | malang      | 2002-09-01 |        1 | ranoon       |
|  3 | 2223 | fita     | P      | bali        | 2003-02-21 |        1 | bucor        |
|  4 | 2224 | fiki     | P      | lintang     | 0000-00-00 |        1 | denpasar     |
|  5 | 2225 | keira    | P      | pakuniran   | 2001-02-21 |        1 | bucor        |
+----+------+----------+--------+-------------+------------+----------+--------------+
5 rows in set (0.008 sec)


MariaDB [dbpegawai]> INSERT INTO pegawai (nip,nama,gender,tmplahir,tgllahir,iddivisi,alamat) VALUES
    -> ('2226','jupri','L','Probolinggo','2003-02-22',2,'bucor'),
    -> ('2227','Izul','L','Probolinggo','2004-02-03',2,'pandan'),
    -> ('2228','Iza','P','Jemberr','2004-02-03',2,'tiris'),
    -> ('2229','Ina','P','Jember','2002-02-29',2,'Kalianan'),
    -> ('2230','Ila','P','Malang','2002-02-24',2,'Kalikajar');
Query OK, 5 rows affected, 1 warning (0.094 sec)
Records: 5  Duplicates: 0  Warnings: 1

MariaDB [dbpegawai]> INSERT INTO pegawai (nip,nama,gender,tmplahir,tgllahir,iddivisi,alamat) VALUES
    -> ('2231','Agus','L','Probolinggo','2001-02-02',3,'bucor'),
    -> ('2232','Dimas','L','Jakarta','2001-10-01',3,'Besuk'),
    -> ('2233','Farhan','L','Jakarta','2001-11-22',3,'Kana'),
    -> ('2234','Fira','P','Probolinggo','2004-11-12',3,'Mais'),
    -> ('2235','linda','P','Probolinggo','2004-11-22',3,'Maron');
Query OK, 5 rows affected (0.039 sec)
Records: 5  Duplicates: 0  Warnings: 0

MariaDB [dbpegawai]> INSERT INTO pegawai (nip,nama,gender,tmplahir,tgllahir,iddivisi,alamat) VALUES
    -> ('2236','Firda','P','Probolinggo','2002-02-03',4,'Kalikajar'),
    -> ('2237','Has','L','Probolinggo','2002-06-03',4,'Bucor'),
    -> ('2238','Zain','L','Probolinggo','2006-06-10',4,'alaskandang'),
    -> ('2239','Abidin','L','Madura','2006-06-30',4,'Pamekasan'),
    -> ('2240','barok','L','Madura','2002-11-30',4,'Sampang');
Query OK, 5 rows affected (0.157 sec)
Records: 5  Duplicates: 0  Warnings: 0

MariaDB [dbpegawai]> SELECT * FROM divisi;
+----+-----------+
| id | nama      |
+----+-----------+
|  4 | IT        |
|  2 | keuangan  |
|  3 | marketing |
|  1 | SDM       |
+----+-----------+
4 rows in set (0.009 sec)

MariaDB [dbpegawai]> SELECT * FROM pegawai;
+----+------+----------+--------+-------------+------------+----------+--------------+
| id | nip  | nama     | gender | tmplahir    | tgllahir   | iddivisi | alamat       |
+----+------+----------+--------+-------------+------------+----------+--------------+
|  1 | 2122 | syahroni | L      | probolinggo | 2002-09-28 |        1 | sumberkembar |
|  2 | 2222 | roni     | L      | malang      | 2002-09-01 |        1 | ranoon       |
|  3 | 2223 | fita     | P      | bali        | 2003-02-21 |        1 | bucor        |
|  4 | 2224 | fiki     | P      | lintang     | 0000-00-00 |        1 | denpasar     |
|  5 | 2225 | keira    | P      | pakuniran   | 2001-02-21 |        1 | bucor        |
| 15 | 2226 | jupri    | L      | Probolinggo | 2003-02-22 |        2 | bucor        |
| 16 | 2227 | Izul     | L      | Probolinggo | 2004-02-03 |        2 | pandan       |
| 17 | 2228 | Iza      | P      | Jemberr     | 2004-02-03 |        2 | tiris        |
| 18 | 2229 | Ina      | P      | Jember      | 0000-00-00 |        2 | Kalianan     |
| 19 | 2230 | Ila      | P      | Malang      | 2002-02-24 |        2 | Kalikajar    |
| 20 | 2231 | Agus     | L      | Probolinggo | 2001-02-02 |        3 | bucor        |
| 21 | 2232 | Dimas    | L      | Jakarta     | 2001-10-01 |        3 | Besuk        |
| 22 | 2233 | Farhan   | L      | Jakarta     | 2001-11-22 |        3 | Kana         |
| 23 | 2234 | Fira     | P      | Probolinggo | 2004-11-12 |        3 | Mais         |
| 24 | 2235 | linda    | P      | Probolinggo | 2004-11-22 |        3 | Maron        |
| 25 | 2236 | Firda    | P      | Probolinggo | 2002-02-03 |        4 | Kalikajar    |
| 26 | 2237 | Has      | L      | Probolinggo | 2002-06-03 |        4 | Bucor        |
| 27 | 2238 | Zain     | L      | Probolinggo | 2006-06-10 |        4 | alaskandang  |
| 28 | 2239 | Abidin   | L      | Madura      | 2006-06-30 |        4 | Pamekasan    |
| 29 | 2240 | barok    | L      | Madura      | 2002-11-30 |        4 | Sampang      |
+----+------+----------+--------+-------------+------------+----------+--------------+
20 rows in set (0.009 sec)

MariaDB [dbpegawai]> UPDATE pegawai SET nama = 'arifsyahroni', tmplahir = 'Probolinggo',alamat = 'sogaan' WHERE id = 2;
Query OK, 1 row affected (0.202 sec)
Rows matched: 1  Changed: 1  Warnings: 0

MariaDB [dbpegawai]> UPDATE pegawai SET nama = 'fikiindra', tmplahir = 'Probolinggo',alamat = 'duren' WHERE id = 4;
Query OK, 1 row affected (0.052 sec)
Rows matched: 1  Changed: 1  Warnings: 0

MariaDB [dbpegawai]> UPDATE pegawai SET nama = 'Jupriyanto', tmplahir = 'Malang',alamat = 'sumberkembar' WHERE id = 15;
Query OK, 1 row affected (0.106 sec)
Rows matched: 1  Changed: 1  Warnings: 0

MariaDB [dbpegawai]> UPDATE pegawai SET nama = 'Inayati', tmplahir = 'Surabaya',alamat = 'alassumur' WHERE id = 18;
Query OK, 1 row affected (0.088 sec)
Rows matched: 1  Changed: 1  Warnings: 0

MariaDB [dbpegawai]> UPDATE pegawai SET nama = 'Hasbullah', tmplahir = 'Kalimantan',alamat = 'alaskandang' WHERE id = 26;
Query OK, 1 row affected (0.106 sec)
Rows matched: 1  Changed: 1  Warnings: 0

MariaDB [dbpegawai]> DELETE FROM pegawai WHERE id = 29;
Query OK, 1 row affected (0.112 sec)

MariaDB [dbpegawai]> DELETE FROM pegawai WHERE id = 28;
Query OK, 1 row affected (0.089 sec)

MariaDB [dbpegawai]> SELECT * FROM pegawai;
+----+------+--------------+--------+-------------+------------+----------+--------------+
| id | nip  | nama         | gender | tmplahir    | tgllahir   | iddivisi | alamat       |
+----+------+--------------+--------+-------------+------------+----------+--------------+
|  1 | 2122 | syahroni     | L      | probolinggo | 2002-09-28 |        1 | sumberkembar |
|  2 | 2222 | arifsyahroni | L      | Probolinggo | 2002-09-01 |        1 | sogaan       |
|  3 | 2223 | fita         | P      | bali        | 2003-02-21 |        1 | bucor        |
|  4 | 2224 | fikiindra    | P      | Probolinggo | 0000-00-00 |        1 | duren        |
|  5 | 2225 | keira        | P      | pakuniran   | 2001-02-21 |        1 | bucor        |
| 15 | 2226 | Jupriyanto   | L      | Malang      | 2003-02-22 |        2 | sumberkembar |
| 16 | 2227 | Izul         | L      | Probolinggo | 2004-02-03 |        2 | pandan       |
| 17 | 2228 | Iza          | P      | Jemberr     | 2004-02-03 |        2 | tiris        |
| 18 | 2229 | Inayati      | P      | Surabaya    | 0000-00-00 |        2 | alassumur    |
| 19 | 2230 | Ila          | P      | Malang      | 2002-02-24 |        2 | Kalikajar    |
| 20 | 2231 | Agus         | L      | Probolinggo | 2001-02-02 |        3 | bucor        |
| 21 | 2232 | Dimas        | L      | Jakarta     | 2001-10-01 |        3 | Besuk        |
| 22 | 2233 | Farhan       | L      | Jakarta     | 2001-11-22 |        3 | Kana         |
| 23 | 2234 | Fira         | P      | Probolinggo | 2004-11-12 |        3 | Mais         |
| 24 | 2235 | linda        | P      | Probolinggo | 2004-11-22 |        3 | Maron        |
| 25 | 2236 | Firda        | P      | Probolinggo | 2002-02-03 |        4 | Kalikajar    |
| 26 | 2237 | Hasbullah    | L      | Kalimantan  | 2002-06-03 |        4 | alaskandang  |
| 27 | 2238 | Zain         | L      | Probolinggo | 2006-06-10 |        4 | alaskandang  |
+----+------+--------------+--------+-------------+------------+----------+--------------+
18 rows in set (0.047 sec)

MariaDB [dbpegawai]>